{
  "processingDate": "2023-12-15T12:30:46Z",
  "schemeDetails": {
    "pSTR": "87219363YN",
    "schemeName": "Abc Ltd"
  },
  "eventReportDetails": {
    "reportStartDate": "2021-04-06",
    "reportEndDate": "2022-04-05",
    "reportStatus": "Compiled",
    "reportVersionNumber": "001",
    "reportSubmittedDateAndTime": "2023-12-13T12:12:12Z",
    "eventType": "Event22"
  },
  "eventDetails": [
    {
      "memberDetail": {
        "memberStatus": "New",
        "event": {
          "eventType": "Event22",
          "individualDetails": {
            "title": "Mr",
            "firstName": "John",
            "middleName": "A",
            "lastName": "Smith",
            "nino": "AA345678B"
          },
          "paymentDetails": {
            "monetaryAmount": 123.99,
            "taxYearEndingDate": "2021-05-30"
          }
        }
      }
    }
  ]
}